Rollno, Name, Section, Dept_Code, Email
19162043, Pooja Kathait, PH- 2-Year M.Pharm (Pharmacognosy) II-Semester, PHE, poojakathait.phe19@itbhu.ac.in
19162045, Shetty Diksha Anand, PH- 2-Year M.Pharm (Pharmacognosy) II-Semester, PHE, shettydikshaanand.phe19@itbhu.ac.in
19162046, Anup Kumar Ray, PH- 2-Year M.Pharm (Pharmacognosy) II-Semester, PHE, anupkumarray.phe19@itbhu.ac.in
19162047, Dilharan, PH- 2-Year M.Pharm (Pharmacognosy) II-Semester, PHE, dilharan.phe19@itbhu.ac.in
19162048, Soki Daeme Malang, PH- 2-Year M.Pharm (Pharmacognosy) II-Semester, PHE, sokidaememalang.phe19@itbhu.ac.in
19161501, HIMANSHU RAI, PH- Ph.D. Admitted in 2019-20 EVEN SEM, PHE, himanshurai.rs.phe19@itbhu.ac.in
19161502, GAURI SHANKAR, PH- Ph.D. Admitted in 2019-20 EVEN SEM, PHE, gaurishankar.rs.phe19@itbhu.ac.in
19021501, RICHA SINGH, BM- Ph.D. Admitted in 2019-20 EVEN SEM, BME, richasingh.rs.bme19@itbhu.ac.in
